{
  "schema_version": "1.0",
  "message_id": "msg_A1b2C3d4E5f6G7h8",
  "trace_id": "trc_Z9y8X7w6V5u4T3s2",
  "issued_at": "2026-10-24T18:05:00Z",
  "sender": { "agent_id": "agt_Qq1Ww2Ee3Rr4Tt5Y", "agent_version": "1.0.0" },
  "represented_student": { "student_ref": "stu_7Kp2Qm9Xr4Lt8Vn3" },
  "scope": {
    "negotiation_id": "neg_Nn1Mm2Bb3Vv4Cc5X",
    "actions": ["propose", "counter", "accept", "reject", "escalate"],
    "expires_at": "2026-10-25T18:00:00Z",
    "max_disclosure_level": "free_busy",
    "granted_by": "per_negotiation"
  },
  "disclosure_level": "free_busy",
  "intent": "propose",
  "payload": {
    "proposed_slot": { "start": "2026-10-28T18:00:00Z", "end": "2026-10-28T19:00:00Z" },
    "availability": {
      "schema_version": "1.0",
      "student_ref": "stu_7Kp2Qm9Xr4Lt8Vn3",
      "generated_at": "2026-10-24T18:00:00Z",
      "timezone": "America/Phoenix",
      "window": { "start": "2026-10-27T00:00:00Z", "end": "2026-10-31T23:59:59Z" },
      "disclosure_level": "free_busy",
      "slots": [ { "start": "2026-10-27T21:00:00Z", "end": "2026-10-27T23:00:00Z", "state": "busy" } ],
      "redactions": 2
    }
  }
}
